{
  "schema_version": "1.0",
  "date": "2026-04-06",
  "baseline_date": "2026-04-05",
  "changed_paths": [
    "/actionable",
    "/market_data/VIX",
    "/narrative/alt_data",
    "/narrative/asset_classes/bonds",
    "/narrative/asset_classes/commodities",
    "/narrative/asset_classes/crypto",
    "/narrative/asset_classes/forex",
    "/narrative/asset_classes/international",
    "/narrative/macro",
    "/narrative/us_equities",
    "/regime/summary",
    "/risks",
    "/sector_scorecard"
  ],
  "ops": [
    {
      "op": "set",
      "path": "/actionable",
      "value": [
        "**EXIT XLV immediately** — If not executed at Monday open, execute now. Drug pricing risk + losing RS. No ceasefire scenario rescues XLV. Proceeds to BIL.",
        "**DO NOT add XLE Monday** — Ceasefire scenario renders energy add highly risky. Oil CTA crowding (90th pctile) = violent unwind if war ends. Hold current 12%; add suspended until Tuesday resolution.",
        "**WATCH Trump ultimatum midnight Tuesday** — Binary catalyst. Check overnight oil futures (DBO/USO) and gold futures pre-market Wednesday for outcome signal. No action before resolution.",
        "**Monitor USD/JPY at 160** — BOJ intervention risk is real at 159.64. An unexpected yen spike from BOJ action would be risk-off cascading. Keep BIL/SHY as buffer.",
        "**T-002 deliberation in progress** — BIL/SHY positions remain valid as cash management even if \"higher-for-longer\" label is retired. Thesis relabeling not position exit."
      ],
      "reason": "Replace actionable list from legacy DIGEST-DELTA.md"
    },
    {
      "op": "set",
      "path": "/risks",
      "value": [
        "**Ceasefire Fails / Escalation (HIGHEST)**: Trump ultimatum expires Tuesday. Iran doesn't comply. US strikes power plants. WTI gaps to $125-130+. Portfolio benefits (energy + gold), but DBO stop might be tested on volatility. Asymmetric upside for current holdings.",
        "**Ceasefire Signed (MODERATE probability ~40%)**: Portfolio faces -15% hit on commodity sleeve (IAU -5-10%, XLE -8-10%, DBO -20%). Short-covering rally in equities won't offset commodity losses given 25% commodity/energy weight. Rapid rebalance needed Wednesday.",
        "**USD/JPY BOJ Intervention (EMERGING)**: 159.64 is above 155 alert level. Sudden yen spike = global carry unwind = risk-off cascade = equities selloff + gold spike. BIL/SHY provide protection but equity whipsaw possible. Watch 160 level."
      ],
      "reason": "Replace risks list from legacy DIGEST-DELTA.md"
    },
    {
      "op": "set",
      "path": "/regime/summary",
      "value": "SHIFTED — Was \"Risk-Off / Mixed\" → Now \"BINARY EVENT PENDING\"",
      "reason": "Set regime summary from delta overall bias line"
    },
    {
      "op": "set",
      "path": "/market_data/VIX",
      "value": 23.87,
      "reason": "Update VIX level from legacy delta"
    },
    {
      "op": "set",
      "path": "/narrative/macro",
      "value": "**Regime Change**: Policy factor corrected: Fed at 3.5-3.75% (was 4.75-5.00%). Risk Appetite: Risk-Off/Mixed → Binary Event Pending.\n\n**Today's Key Events** (new data):\n| Time | Event | Consensus | Prior | Actual |\n|------|-------|-----------|-------|--------|\n| Overnight | Iran/US Ceasefire Proposal | — | N/A | Received by US; Trump NOT signed |\n| Monday | Trump Iran Ultimatum | — | N/A | Open Hormuz by Tuesday or \"hell\" |\n| EOD | Markets digest binary outcome | — | Good Friday closed | SPY +0.12%, DXY <100 |\n\n**Central Banks**: Fed at 3.5-3.75% (CONFIRMED correction). One more cut expected by year-end. May cut probability 35% (declining). March 2026 FOMC held for 2nd consecutive meeting.\n**Critical Tuesday Event**: Trump ultimatum expires. No outcome is announced in advance. Watch overnight oil futures and safe-haven flows for real-time signal.\n\n---",
      "reason": "Update narrative block from legacy section: Macro & Events"
    },
    {
      "op": "set",
      "path": "/narrative/us_equities",
      "value": "**Bias**: UNCHANGED: Neutral / Conflicted\n**Indices**: SPY ~$656-658 (+0.12%) | QQQ ~$587 (+0.42%) | Dow -0.18%\n**Notable movers**: XLRE +1.61% (rate relief + dollar weakness), XLY -1.5% (consumer stress), XLE -0.62% (war premium pricing out)\n**VIX**: 23.87 — NOT declining on ceasefire hopes. Market doesn't believe definitive resolution is imminent. Tail risk hedging maintained.\n\n---",
      "reason": "Update narrative block from legacy section: Equities"
    },
    {
      "op": "set",
      "path": "/narrative/asset_classes/crypto",
      "value": "**Bias**: SHIFTED: Neutral/Conflicted → Neutral/Tentative Risk-On\n**BTC**: $69,356-$70,010 (+2.5% from Sunday open; briefly above $70K) | **ETH**: $2,124 (+0.72%)\n**Notable**: BTC crossed $70K on ceasefire news — first time in ~10 days. De-escalation = risk-on beta play. Crypto confirmed as risk asset (NOT safe haven). Next resistance: $72K (200-DMA). Support: $65K.\n**No position change**: 0% crypto allocation maintained.\n\n---",
      "reason": "Update narrative block from legacy section: Crypto"
    },
    {
      "op": "set",
      "path": "/narrative/asset_classes/bonds",
      "value": "**Bias**: SHIFTED: Bullish short duration / Bearish long → Bullish short duration / NEUTRAL long\n**Yields**: 3M: 3.607% | 10Y: 4.313% (Δ-4bps from baseline) | 30Y: 4.89% (ELEVATED — inflation premium)\n**Fed**: 3.50-3.75% actual rate (data correction). One cut expected by year-end. 3m10y curve: POSITIVE +70.6bps (not inverted — correction from baseline which implied inversion).\n**T-002 Update**: ⚠️ Challenged — Fed already cut ~100bps from cycle peak. Portfolio monitor assessing implications.\n\n---",
      "reason": "Update narrative block from legacy section: Bonds"
    },
    {
      "op": "set",
      "path": "/narrative/asset_classes/commodities",
      "value": "**Bias**: SHIFTED: Bullish Energy/Neutral PM → NEUTRAL Energy (binary) / BULLISH PM (gold recovering)\n**Energy**: WTI $109.56-$115.37 (range) / ~$110.70 current. Binary. No directional bias.\n**Gold**: ~$4,660-$4,680/oz (+6% from $4,400 baseline). IAU estimated $92.50-$93.50 (vs $87.94 baseline). ✅ Thesis strongly confirmed.\n**Copper**: $5.61 (+0.90%) — leading indicator for de-escalation pricing.\n\n---",
      "reason": "Update narrative block from legacy section: Commodities"
    },
    {
      "op": "set",
      "path": "/narrative/asset_classes/forex",
      "value": "**DXY**: 99.81-100.14 (-3.3% from baseline 103.5) — BROKE BELOW 100\n**Notable pairs**: EUR/USD 1.15 (+6.5% from 1.080 baseline) — massive repricing on ceasefire/energy relief. USD/JPY 159.64 — BOJ intervention risk ELEVATED (above 155 alert level).\n**USD selling** is broadly positive for gold, EM, and commodities in non-USD terms.\n\n---",
      "reason": "Update narrative block from legacy section: Forex"
    },
    {
      "op": "set",
      "path": "/narrative/asset_classes/international",
      "value": "**Notable**: Europe improving on EUR/energy relief (not held — AVOID maintained). Oil-importing EM (EWY, INDA, EWT) selectively improving. China unchanged (stimulus fading, not war-related). BOJ intervention risk at USD/JPY 159.64 = critical watch.\n\n---",
      "reason": "Update narrative block from legacy section: International"
    },
    {
      "op": "set",
      "path": "/narrative/alt_data",
      "value": "**Sentiment shift**: Transitioning from Risk-Off → Binary. Partial de-escalation probability priced.\n**Notable signals**: CTA oil unwind risk CRYSTALLIZED — if ceasefire signed, forced mechanical unwind of 290k WTI contracts ($10-15/bbl in 2-3 sessions). This is the single biggest portfolio risk on Tuesday. Polymarket Iran escalation odds declining from 62% toward ~50%.\n\n---",
      "reason": "Update narrative block from legacy section: Alternative Data"
    },
    {
      "op": "set",
      "path": "/sector_scorecard/energy/bias",
      "value": "OW",
      "reason": "Sector scorecard update for Energy"
    },
    {
      "op": "set",
      "path": "/sector_scorecard/energy/key_driver",
      "value": "Oil whipsawing on ceasefire; de-escalation risk",
      "reason": "Sector scorecard driver update for Energy"
    },
    {
      "op": "set",
      "path": "/sector_scorecard/real_estate/bias",
      "value": "UW",
      "reason": "Sector scorecard update for Real Estate"
    },
    {
      "op": "set",
      "path": "/sector_scorecard/real_estate/key_driver",
      "value": "DXY -3.3%, rate relief, XLRE +1.61%",
      "reason": "Sector scorecard driver update for Real Estate"
    },
    {
      "op": "set",
      "path": "/sector_scorecard/consumer_disc/bias",
      "value": "UW",
      "reason": "Sector scorecard update for Con. Disc"
    },
    {
      "op": "set",
      "path": "/sector_scorecard/consumer_disc/key_driver",
      "value": "-1.50% today, worst sector; consumer squeeze",
      "reason": "Sector scorecard driver update for Con. Disc"
    }
  ],
  "notes": "Retrofitted from legacy DIGEST-DELTA.md; aligned with templates/delta-request-schema.json."
}
