{
  "schema_version": "1.0",
  "date": "2026-04-07",
  "baseline_date": "2026-04-05",
  "changed_paths": [
    "/actionable",
    "/market_data/VIX",
    "/narrative/alt_data",
    "/narrative/asset_classes/bonds",
    "/narrative/asset_classes/commodities",
    "/narrative/asset_classes/crypto",
    "/narrative/macro",
    "/narrative/us_equities",
    "/regime/summary",
    "/risks",
    "/sector_scorecard"
  ],
  "ops": [
    {
      "op": "set",
      "path": "/actionable",
      "value": [
        "**EXIT XLV IMMEDIATELY** — Three sessions overdue. Move 8% proceeds to BIL. No holding rationale in any war scenario. Price is immaterial — just exit.",
        "**RAISE DBO STOP to $20 (~WTI $105)** — Kharg Island creates a structural WTI floor. Prior $18 stop was set before this supply disruption was confirmed. Protect gains by raising the floor.",
        "**DO NOT ADD XLE OR DBO** — Energy CTAs at 90th+ percentile. Crowding rule is absolute. You own 17% energy exposure — that is sufficient. A 15% probability surprise deal still mechanically unwinds 290k+ contracts.",
        "**HOLD ALL POSITIONS THROUGH 8PM ET** — Do not trade in the final hours before tonight's deadline. The overnight outcome drives Wednesday's opening gap. Wednesday AM is the next decision point.",
        "**PREPARE TWO WEDNESDAY SCENARIOS**: (a) Infrastructure strikes proceed → WTI $120-130+, SPY -2-4% pre-market → HOLD all, add IAU to 25%; (b) Surprise deal/delay → WTI -$10-15, SPY +3-4% → Execute rapid rotation to SPY/QQQ, trim XLE/DBO."
      ],
      "reason": "Replace actionable list from legacy DIGEST-DELTA.md"
    },
    {
      "op": "set",
      "path": "/risks",
      "value": [
        "**Infrastructure Strikes Proceed (>75% probability)**: Strikes on Iranian bridges and power plants at 8pm ET. WTI spikes to $120-130. SPY futures down 2-4%. Gold +2-3%. Net portfolio: positive (energy + gold up, BIL stable). Response: Hold, raise IAU to 25% on Wednesday open.",
        "**Iranian Retaliation (20-40% probability if US strikes proceed)**: Iran responds with missile strikes on Gulf oil infrastructure, US/Israeli assets, or proxy network activation. If major Gulf facility hit: Brent $130-150. Portfolio benefits further on energy/gold; recession risk escalates. Monitor overnight news.",
        "**CTA Energy Unwind — Surprise Deal (15% probability)**: Trump delays AGAIN or surprise deal emerges. WTI -$10-15/bbl, DBO/XLE -8-12%, total portfolio -3%. Response: Wednesday rebalance — exit DBO, trim XLE, rotate to SPY/QQQ."
      ],
      "reason": "Replace risks list from legacy DIGEST-DELTA.md"
    },
    {
      "op": "set",
      "path": "/regime/summary",
      "value": "SHIFTED — Was: BINARY EVENT PENDING / TRANSITIONAL → **Now: ESCALATION CONFIRMED — FULL RISK-OFF**",
      "reason": "Set regime summary from delta overall bias line"
    },
    {
      "op": "set",
      "path": "/market_data/VIX",
      "value": 27.04,
      "reason": "Update VIX level from legacy delta"
    },
    {
      "op": "set",
      "path": "/narrative/macro",
      "value": "**Regime Change**: Binary/Transitional → ESCALATION CONFIRMED\n\n**Today's Key Events**:\n| Time | Event | Detail |\n|------|-------|--------|\n| ~7am ET | Kharg Island Strikes | US struck 50+ military targets on Iran's main oil export hub (~90% of Iranian crude) |\n| ~8pm ET | Trump Deadline | Iran must reopen Hormuz or face infrastructure strikes (power plants + bridges) |\n| April 6 | Iran Rejects Ceasefire | 45-day proposal rejected; Iran wants permanent peace, sanctions lifted |\n| April 7 AM | Iran Stops Negotiating | Per NYT: Iran halted talks with US mediators |\n\n**CRITICAL — Tonight 8pm ET**: If Trump proceeds with infrastructure strikes — markets react violently overnight. WTI could spike to $120-130. SPY futures down 2-4% at Wednesday open.\n\n**Central Banks**: UNCHANGED — Fed 3.50–3.75%. May cut probability ~30% (oil inflation reduces urgency).\n\n---",
      "reason": "Update narrative block from legacy section: Macro & Events"
    },
    {
      "op": "set",
      "path": "/narrative/us_equities",
      "value": "**Bias**: SHIFTED: Neutral/Conflicted → **BEARISH (Escalation Confirmed)**\n\n**Indices**: SPY: ~$654-655 (-0.7%) | QQQ: ~$580 (-1.1%) | IWM: ~$249 (-0.7%) | Dow: -0.5%\n\n**VIX**: 27.04 (+3.17 pts, +13.3% from 23.87) — Significant spike; fear rising, not ebbing.\n\n**Sector rotation**: 10 of 11 sectors red. Energy bucking trend (XLE slight gain on WTI +3%). Consumer Discretionary and Technology leading losses. XLRE reversed — downgrade to Bearish (ceasefire narrative gone).\n\n**Key watch**: SPY 50-DMA at ~$652. Close below = path to $640 support.\n\n---",
      "reason": "Update narrative block from legacy section: Equities"
    },
    {
      "op": "set",
      "path": "/narrative/asset_classes/crypto",
      "value": "**Bias**: SHIFTED: Neutral/Tentative Risk-On → **BEARISH / Risk-Off Confirmed**\n\n**BTC**: ~$68,395 (opened $68,860; -2.3% from $70K Monday peak) | Trending lower into 8pm deadline\n**ETH**: ~$2,124-$2,145 | ETH/BTC weak — altcoins underperforming\n**Fear & Greed**: 11/100 — EXTREME FEAR (collapsed from 48-52 in 24 hours)\n**BTC ETF Flows**: Monday = largest inflows since late February (institutional accumulation); retail sold 62K BTC in Q1, corporates bought 69K BTC\n\nCrypto confirmed as risk-on asset, NOT safe haven. 0% portfolio allocation validated. If infrastructure strikes tonight: BTC likely tests $65K.\n\n---",
      "reason": "Update narrative block from legacy section: Crypto"
    },
    {
      "op": "set",
      "path": "/narrative/asset_classes/bonds",
      "value": "**Bias**: UNCHANGED: Bullish short duration / Neutral long duration (conviction INCREASED)\n\n**Yields**: 10Y ~4.31% (intraday spike to 4.38%, settled ~flat day-over-day). Competing forces: flight-to-safety bid vs. oil inflation premium roughly offsetting.\n**VIX**: 27.04 — rising vol strengthens safe-haven bid for short-duration Treasuries\n**BIL**: Performing dual role: 3.6% yield + flight-to-safety appreciation. Conviction strong.\n**TLT**: STILL AVOID — 30Y inflation premium not abating with WTI at $116.\n\n---",
      "reason": "Update narrative block from legacy section: Bonds"
    },
    {
      "op": "set",
      "path": "/narrative/asset_classes/commodities",
      "value": "**Bias**: SHIFTED: Neutral Energy (Binary) → **BULLISH Energy (Escalation Confirmed)**\n\n| Asset | Prior Level | Now | Change |\n|-------|------------|-----|--------|\n| WTI | ~$110.70 | ~$114.81–$116.00 | +3-5% |\n| Gold | ~$4,660–$4,680/oz | ~$4,678–$4,694/oz | Flat (±$15) |\n| IAU | ~$93-94 est. | ~$93-94 est. | Unchanged |\n| DBO | ~$19.30–$19.50 | ~$19.80–$20.20 est. | +2-4% |\n| XLE | $58.88 | ~$59.50-59.70 | Slight gain |\n\nKharg Island strike = supply disruption structural, not speculative. WTI $120-$130+ is the base case if tonight's infrastructure strikes proceed. DBO stop raised from $18 to $20 (WTI ~$105).\n\n---",
      "reason": "Update narrative block from legacy section: Commodities"
    },
    {
      "op": "set",
      "path": "/narrative/alt_data",
      "value": "**Sentiment shift**: COLLAPSED to EXTREME FEAR\n\n| Indicator | Prior | Now |\n|-----------|-------|-----|\n| Equity F&G | ~50 (Neutral) | ~25-30 est. (Fear) |\n| Crypto F&G | 48-52 (Neutral) | 11 (Extreme Fear) |\n| Polymarket: Escalation | ~48-55% | 69% (through April 30) |\n| Polymarket: Near-term ceasefire | ~40-50% | <15% |\n| VIX | 23.87 | 27.04 |\n\nContrarian note: F&G 11 is mechanically a capitulation zone — but NOT a buy signal while 8pm event risk is live. Wait for outcome first.\n\n---",
      "reason": "Update narrative block from legacy section: Alternative Data"
    },
    {
      "op": "set",
      "path": "/sector_scorecard/energy/bias",
      "value": "OW",
      "reason": "Sector scorecard update for Energy"
    },
    {
      "op": "set",
      "path": "/sector_scorecard/energy/key_driver",
      "value": "WTI +3% Kharg Island supply shock",
      "reason": "Sector scorecard driver update for Energy"
    },
    {
      "op": "set",
      "path": "/sector_scorecard/technology/bias",
      "value": "UW",
      "reason": "Sector scorecard update for Technology"
    },
    {
      "op": "set",
      "path": "/sector_scorecard/technology/key_driver",
      "value": "-1.1% risk-off sell",
      "reason": "Sector scorecard driver update for Technology"
    },
    {
      "op": "set",
      "path": "/sector_scorecard/real_estate/bias",
      "value": "UW",
      "reason": "Sector scorecard update for Real Estate"
    },
    {
      "op": "set",
      "path": "/sector_scorecard/real_estate/key_driver",
      "value": "Ceasefire narrative collapsed",
      "reason": "Sector scorecard driver update for Real Estate"
    }
  ],
  "notes": "Retrofitted from legacy DIGEST-DELTA.md; aligned with templates/delta-request-schema.json."
}
